Title,Year,Rating,Genre,Director(s),Box Office Revenue,Lead Actors
1. The Shawshank Redemption,1994,9.3 (3M),"Epic, Period Drama, Prison Drama, Drama","The Ink Spots, Frank Darabont, Stephen King, Tim Robbins, Bob Gunton, Hank Williams, Jack Lawrence, Andy Dufresne, Morgan Freeman","Gross worldwide$29,332,133","Tim Robbins, Bob Gunton, Morgan Freeman"
2. The Godfather,1972,9.2 (2.1M),"Epic, Gangster, Tragedy, Crime, Drama","James Caan, Carmine Coppola, Francis Ford Coppola, Marlon Brando, Peter Clemenza, Al Pacino, Mario Puzo","Gross worldwide$250,342,198","Marlon Brando, James Caan, Al Pacino"
3. The Dark Knight,2008,9.0 (3M),"Action Epic, Epic, Superhero, Tragedy, Action, Crime, Drama, Thriller","Jonathan Nolan, Jack Nicholson, Michael Caine, Salvatore Maroni, The Pipes and Drums of the Chicago Police Department, Aaron Eckhart, The Chechen, The Joker, Heath Ledger, Christian Bale, Christopher Nolan, David S. Goyer","Gross worldwide$1,009,057,329","Heath Ledger, Christian Bale, Aaron Eckhart"
4. The Godfather Part II,1974,9.0 (1.4M),"Epic, Gangster, Tragedy, Crime, Drama","Michael Corleone, Francesco Pennino, Robert Duvall, Francis Ford Coppola, Robert De Niro, Al Pacino, Livio Giorgi, Mario Puzo","Gross worldwide$47,964,222","Robert De Niro, Robert Duvall, Al Pacino"
5. 12 Angry Men,1957,9.0 (917K),"Legal Drama, Psychological Drama, Crime, Drama","Juror #11, Juror #8, Martin Balsam, Sidney Lumet, E.G. Marshall, Juror #10, Lee J. Cobb, Henry Fonda, Jack Warden, Reginald Rose, Marvin Hatley","Gross worldwide$2,945","Martin Balsam, Lee J. Cobb, Henry Fonda"
6. The Lord of the Rings: The Return of the King,2003,9.0 (2.1M),"Action Epic, Adventure Epic, Epic, Fantasy Epic, Mountain Adventure, Quest, Sword & Sorcery, Tragedy, Adventure, Drama","Ian McKellen, John Rhys-Davies, Peter Jackson, Philippa Boyens, Annie Lennox, Viggo Mortensen, Aragorn, Elijah Wood, Howard Shore, J.R.R. Tolkien, Fran Walsh","Gross worldwide$1,138,267,561","Ian McKellen, Elijah Wood, Viggo Mortensen"
7. Schindler's List,1993,9.0 (1.5M),"Docudrama, Epic, Historical Epic, Period Drama, Prison Drama, Tragedy, Biography, Drama, History","Steven Zaillian, Mimi Thoma, Ralph Fiennes, Thomas Keneally, Liam Neeson, Steven Spielberg, Amon Göth, Oskar Schindler, Ben Kingsley, Mila Pfefferberg, Amon Goeth, Franz Xaver Kappus, Oskar Schima","Gross worldwide$322,161,245","Liam Neeson, Ralph Fiennes, Ben Kingsley"
8. Pulp Fiction,1994,8.9 (2.3M),"Dark Comedy, Drug Crime, Gangster, Crime, Drama","Bruce Willis, Fred Wise, John Travolta, Roger Avary, Milton Leeds, Uma Thurman, Dick Dale & His Del-Tones, Nicholas Roubanis, Bob Russell, Vincent, Mia, Samuel L. Jackson, Quentin Tarantino","Gross worldwide$213,928,762","Uma Thurman, John Travolta, Samuel L. Jackson"
9. The Lord of the Rings: The Fellowship of the Ring,2001,8.9 (2.1M),"Action Epic, Adventure Epic, Epic, Fantasy Epic, Quest, Sword & Sorcery, Adventure, Drama, Fantasy","Ian McKellen, Frodo, David Long, Peter Jackson, Orlando Bloom, David Donaldson, Philippa Boyens, Christopher Lee, Chris O'Connor, Elijah Wood, J.R.R. Tolkien, Steve Roche, Janet Roddick, Fran Walsh, Gandalf","Gross worldwide$888,171,906","Ian McKellen, Elijah Wood, Orlando Bloom"
"10. The Good, the Bad and the Ugly",1966,8.8 (847K),"Adventure Epic, Dark Comedy, Desert Adventure, Epic, Period Drama, Quest, Spaghetti Western, Western Epic, Adventure, Western","Agenore Incrocci, Eli Wallach, Sergio Leone, Tommie Connor, Blondie, Lee Van Cleef, Clint Eastwood, Luciano Vincenzoni","Gross worldwide$25,264,999","Lee Van Cleef, Clint Eastwood, Eli Wallach"
11. Forrest Gump,1994,8.8 (2.4M),"Epic, Drama, Romance","Gary Sinise, Robert Zemeckis, Eric Roth, Irving Mills, Tom Hanks, Hank Williams, Young Man Running, Forrest Gump, Robin Wright, Winston Groom, Cliff Friend","Gross worldwide$678,226,465","Gary Sinise, Robin Wright, Tom Hanks"
12. The Lord of the Rings: The Two Towers,2002,8.8 (1.9M),"Action Epic, Adventure Epic, Dark Fantasy, Epic, Fantasy Epic, Quest, Sword & Sorcery, Adventure, Drama, Fantasy","Ian McKellen, Frodo, Peter Jackson, Philippa Boyens, Sam, Viggo Mortensen, Emiliana Torrini, Elijah Wood, Howard Shore, J.R.R. Tolkien, Fran Walsh","Gross worldwide$938,242,927","Ian McKellen, Elijah Wood, Viggo Mortensen"
13. Fight Club,1999,8.8 (2.4M),"Psychological Drama, Workplace Drama, Drama","Chuck Palahniuk, Holt McCallany, David Fincher, Jim Uhls, Edward Norton, Brad Pitt, Matt Winston, Tyler Durden, Rolfe Kent, Meat Loaf","Gross worldwide$101,321,009","Edward Norton, Brad Pitt, Meat Loaf"
14. Inception,2010,8.8 (2.7M),"Action Epic, Adventure Epic, Epic, Psychological Thriller, Sci-Fi Epic, Action, Adventure, Sci-Fi, Thriller","Édith Piaf, Elliot Page, Joseph Gordon-Levitt, Charles Dumont, Michel Vaucaire, Cobb, Hans Zimmer, Christopher Nolan, Leonardo DiCaprio","Gross worldwide$839,030,630","Joseph Gordon-Levitt, Elliot Page, Leonardo DiCaprio"
15. Star Wars: Episode V - The Empire Strikes Back,1980,8.7 (1.4M),"Action Epic, Adventure Epic, Dark Fantasy, Epic, Fantasy Epic, Globetrotting Adventure, Quest, Sci-Fi Epic, Space Sci-Fi, Sword & Sorcery","Yoda, Leigh Brackett, Mark Hamill, Luke, Irvin Kershner, Lawrence Kasdan, Carrie Fisher, George Lucas, Harrison Ford","Gross worldwide$550,016,086","Carrie Fisher, Mark Hamill, Harrison Ford"
16. The Matrix,1999,8.7 (2.1M),"Action Epic, Artificial Intelligence, Cyberpunk, Dystopian Sci-Fi, Gun Fu, Martial Arts, Sci-Fi Epic, Action, Sci-Fi","Massive Attack, Lana Wachowski, Grant Marshall, Morpheus, Lilly Wachowski, Laurence Fishburne, Andrew Vowles, Carrie-Anne Moss, Keanu Reeves, Robert Del Naja","Gross worldwide$467,841,735","Keanu Reeves, Laurence Fishburne, Carrie-Anne Moss"
17. Goodfellas,1990,8.7 (1.3M),"Docudrama, Gangster, True Crime, Biography, Crime, Drama","Tony Bennett, Jerry Ross, Henry Hill, Martin Scorsese, Robert De Niro, Ray Liotta, Nicholas Pileggi, Richard Adler, Joe Pesci","Gross worldwide$47,058,317","Robert De Niro, Ray Liotta, Joe Pesci"
18. One Flew Over the Cuckoo's Nest,1975,8.7 (1.1M),"Medical Drama, Psychological Drama, Drama","Louise Fletcher, Jack Nicholson, Lew Pollack, Ken Kesey, Brad Dourif, Bo Goldman, Lawrence Hauben, Erno Rapee, Michael Berryman, McMurphy, Milos Forman","Gross worldwide$109,115,366","Michael Berryman, Louise Fletcher, Jack Nicholson"
19. Interstellar,2014,8.7 (2.3M),"Adventure Epic, Epic, Quest, Sci-Fi Epic, Space Sci-Fi, Time Travel, Adventure, Drama, Sci-Fi","Jonathan Nolan, Anne Hathaway, Dylan Thomas, Kip Thorne, Cooper, Jessica Chastain, Christopher Nolan, Matthew McConaughey","Gross worldwide$758,464,713","Jessica Chastain, Anne Hathaway, Matthew McConaughey"
20. Se7en,1995,8.6 (1.9M),"Cop Drama, Hard-boiled Detective, Legal Drama, Police Procedural, Psychological Drama, Psychological Thriller, Serial Killer, Crime, Drama, Mystery","Trent Reznor, David Fincher, Nine Inch Nails, Brad Pitt, Leland Orser, Morgan Freeman, Andrew Kevin Walker, John Doe, David Mills, Kevin Spacey","Gross worldwide$328,971,354","Morgan Freeman, Brad Pitt, Kevin Spacey"
21. It's a Wonderful Life,1946,8.6 (525K),"Feel-Good Romance, Holiday Family, Holiday Romance, Psychological Drama, Supernatural Fantasy, Drama, Family, Fantasy, Holiday, Romance","Lionel Barrymore, Clarence, Frank Capra, James Stewart, Gloria Grahame, William Cool White, Frances Goodrich, Donna Reed, Albert Hackett","Gross worldwide$10,635,461","Lionel Barrymore, Donna Reed, James Stewart"
22. Seven Samurai,1954,8.6 (382K),"Action Epic, Epic, Period Drama, Samurai, Action, Drama","Akira Kurosawa, Shinobu Hashimoto, Takashi Shimura, Kambei Shimada, Keiko Tsushima, Toshirô Mifune, Sôjirô Motoki, Hideo Oguni","Gross worldwide$1,082,148","Keiko Tsushima, Toshirô Mifune, Takashi Shimura"
23. The Silence of the Lambs,1991,8.6 (1.6M),"Police Procedural, Psychological Drama, Psychological Horror, Psychological Thriller, Serial Killer, Slasher Horror, Crime, Drama, Horror, Thriller","Anthony Hopkins, Jonathan Demme, Tom Petty, Ted Tally, Thomas Harris, Tom Petty & The Heartbreakers, Jodie Foster, Scott Glenn, Hannibal Lecter","Gross worldwide$272,742,922","Anthony Hopkins, Jodie Foster, Scott Glenn"
24. Saving Private Ryan,1998,8.6 (1.6M),"Epic, Period Drama, War Epic, Drama, War","Upham, Matt Damon, Mellish, Duke Ellington, Tom Hanks, Tom Sizemore, Steven Spielberg, Edgar De Lange, Robert Rodat, Irving Mills","Gross worldwide$482,352,390","Matt Damon, Tom Hanks, Tom Sizemore"
25. City of God,2002,8.6 (832K),"Caper, Coming-of-Age, Gangster, Crime, Drama","Matheus Nachtergaele, Carlos Cachaça, Alexandre Rodrigues, Hermínio Bello de Carvalho, Leandro Firmino, Bráulio Mantovani, Graziella Moretto, Paulo Lins, Buscapé, Fernando Meirelles, Kátia Lund, Cartola","Gross worldwide$30,681,033","Matheus Nachtergaele, Alexandre Rodrigues, Leandro Firmino"
26. The Green Mile,1999,8.6 (1.5M),"Period Drama, Prison Drama, Supernatural Fantasy, Tragedy, Crime, Drama, Fantasy, Mystery","Old Paul Edgecomb, Lew Pollack, Frank Darabont, Tom Hanks, Ronald Binge, Stephen King, David Morse, Mantovani, Erno Rapee, Michael Clarke Duncan","Gross worldwide$286,801,374","David Morse, Michael Clarke Duncan, Tom Hanks"
27. Life Is Beautiful,1997,8.6 (773K),"Period Drama, Romantic Comedy, Tragedy, Tragic Romance, Comedy, Drama, Romance, War","Vincenzo Cerami, Roberto Benigni, Guido, Bartolomeo, Giorgio Cantarini, Giuseppe Gabetti, Nicoletta Braschi","Gross worldwide$230,099,013","Nicoletta Braschi, Giorgio Cantarini, Roberto Benigni"
28. Terminator 2: Judgment Day,1991,8.6 (1.2M),"Action Epic, Artificial Intelligence, Cyberpunk, Dystopian Sci-Fi, Sci-Fi Epic, Time Travel, Action, Adventure, Sci-Fi","Izzy Stradlin, Guns N' Roses, The Terminator, Axl Rose, Edward Furlong, Linda Hamilton, Arnold Schwarzenegger, Robert Patrick, William Wisher, James Cameron","Gross worldwide$517,778,573","Arnold Schwarzenegger, Edward Furlong, Linda Hamilton"
29. Star Wars: Episode IV - A New Hope,1977,8.6 (1.5M),"Action Epic, Adventure Epic, Epic, Fantasy Epic, Quest, Sci-Fi Epic, Space Sci-Fi, Sword & Sorcery, Action, Adventure","Han Solo, Mark Hamill, Steven Spielberg, Carrie Fisher, George Lucas, Harrison Ford","Gross worldwide$775,398,507","Carrie Fisher, Mark Hamill, Harrison Ford"
30. Back to the Future,1985,8.5 (1.4M),"High-Concept Comedy, Teen Adventure, Teen Comedy, Time Travel, Urban Adventure, Adventure, Comedy, Sci-Fi","Marty McFly, Robert Zemeckis, Johnny Colla, Michael J. Fox, Huey Lewis, Huey Lewis & The News, Chris Hayes, Christopher Lloyd, Lea Thompson, Dr. Emmett Brown, Bob Gale, Eric Stoltz","Gross worldwide$385,053,307","Lea Thompson, Christopher Lloyd, Michael J. Fox"
31. Spirited Away,2001,8.6 (900K),"Anime, Coming-of-Age, Fairy Tale, Hand-Drawn Animation, Quest, Supernatural Fantasy, Adventure, Animation, Family, Fantasy","Hayao Miyazaki, Suzanne Pleshette, Joe Hisaishi, Daveigh Chase, Zeniba, Miyu Irino","Gross worldwide$358,862,570","Daveigh Chase, Miyu Irino, Suzanne Pleshette"
32. The Pianist,2002,8.5 (961K),"Docudrama, Epic, Period Drama, Tragedy, War Epic, Biography, Drama, Music, War","Frédéric Chopin, Thomas Kretschmann, Henryk Szpilman, Roman Polanski, Ronald Harwood, Adrien Brody, Wladyslaw Szpilman, Frank Finlay","Gross worldwide$120,098,945","Thomas Kretschmann, Frank Finlay, Adrien Brody"
33. Gladiator,2000,8.5 (1.7M),"Action Epic, Adventure Epic, Epic, Period Drama, Sword & Sandal, Action, Adventure, Drama","Walter Maioli, William Nicholson, John Logan, Maximus, Nathalie Van Ravenstein, Connie Nielsen, Synaulia, David Franzoni, Joaquin Phoenix, Ridley Scott, Russell Crowe","Gross worldwide$465,516,248","Joaquin Phoenix, Russell Crowe, Connie Nielsen"
34. Parasite,2019,8.5 (1M),"Dark Comedy, Korean Drama, Psychological Thriller, Tragedy, Drama, Thriller","Bong Joon Ho, Han Jin-won, Ki-taek, Cho Yeo-jeong, Lee Sun-kyun, George Frideric Handel, Song Kang-ho","Gross worldwide$262,608,117","Cho Yeo-jeong, Lee Sun-kyun, Song Kang-ho"
35. Psycho,1960,8.5 (748K),"Dark Comedy, Psychological Horror, Psychological Thriller, Slasher Horror, Suspense Mystery, Horror, Mystery, Thriller","Alfred Hitchcock, Bernard Herrmann, Joseph Stefano, Vera Miles, Norma Bates, Robert Bloch, Anthony Perkins, Janet Leigh","Gross worldwide$32,248,065","Vera Miles, Anthony Perkins, Janet Leigh"
36. The Lion King,1994,8.5 (1.2M),"Animal Adventure, Coming-of-Age, Hand-Drawn Animation, Jungle Adventure, Adventure, Animation, Drama, Family, Fantasy, Musical","Terry Bradford, Philile Seme, Bongani Ngcobo, Roger Allers, Maxine Waters Willard, Luther Waters, Baby Cele, Yvonne Williams, Bob Joyce, Khuluiwe Sithole, Scar, James Earl Jones, Rick Charles, Thembi Kubheka, Rick Riso, Ron Kunene, Kevin Dorsey, Zolile Zulu, Linda Woolverton, Elton John, Stella Khumalo, Rick Logan, Sindisiwe Sokhela, Terry Young, Myrna Matthews, Edie Lehmann Boddicker, Kipizane Skweyiya, Jeremy Irons, Carmen Twillie, Nonhlanhla Mkhize, Vusi Mhlongo, Thandazile, Oren Waters, Hans Zimmer, Lebo M., Johnny Britt, Nini Nkosi, Faca Khulu, Phindile, Rodney Saulsberry, Faith Kekana, Thembi Mtshali, Matthew Broderick, John J West, Maxi Anderson, Nandi Ndlovu, Linda Gcwensa, Rob Minkoff, Clydene Jackson, Wendy Fraser, Lucky Cele, Skhumbuzo Kubheka, Abner A. Mariri, Tim Rice, Tsidi Manye, Batho Mhlongo, Susie Stevens-Logan, Luyanda Jezile, Sphiwe Khanyile, Jonathan Roberts, Frank Welker, Khanyo Maphumulo, Bobbi Page, Sam Vamplew, Happy Skhakhane, James Langa, Bheki Ndlovu, Julia Waters, Alfie Silas, Gugwana Dlamini, Matoab'sane Jali, Irene Mecchi","Gross worldwide$979,161,373","Jeremy Irons, Matthew Broderick, James Earl Jones"
37. Grave of the Fireflies,1988,8.5 (343K),"Adult Animation, Anime, Hand-Drawn Animation, Period Drama, Animation, Drama, War","Isao Takahata, Seita, Ayano Shiraishi, H.R. Bishop, Akiyuki Nosaka, Amelita Galli-Curci, Akemi Yamaguchi, Tsutomu Tatsumi","Gross worldwide$839,052","Akemi Yamaguchi, Ayano Shiraishi, Tsutomu Tatsumi"
38. The Departed,2006,8.5 (1.5M),"Cop Drama, Epic, Gangster, Crime, Drama, Thriller","Dignam, Jack Nicholson, Matt Damon, Keith Richards, Martin Scorsese, Mick Jagger, Police Camera Tech, The Rolling Stones, William Monahan, Alan Mak, Felix Chong, Leonardo DiCaprio","Gross worldwide$291,481,358","Jack Nicholson, Matt Damon, Leonardo DiCaprio"
39. Whiplash,2014,8.5 (1.1M),"Psychological Drama, Drama, Music","Damien Chazelle, J.K. Simmons, Miles Teller, Terence Fletcher, Melissa Benoist, Justin Hurwitz","Gross worldwide$50,360,880","J.K. Simmons, Melissa Benoist, Miles Teller"
40. Harakiri,1962,8.6 (78K),"Period Drama, Drama, Mystery","Shinobu Hashimoto, Masaki Kobayashi, Hanshiro Tsugumo, Yasuhiko Takiguchi, Akira Ishihama, Shima Iwashita, Tatsuya Nakadai","Gross worldwide$15,222","Akira Ishihama, Shima Iwashita, Tatsuya Nakadai"
41. American History X,1998,8.5 (1.2M),"Prison Drama, Tragedy, Crime, Drama","David McKenna, Julia Ward Howe, Tony Kaye, Beverly D'Angelo, Tom Hanks, William Steffe, Edward Norton, Derek Vinyard, Bob Sweeney, Edward Furlong, Ethan Suplee","Gross worldwide$23,875,714","Beverly D'Angelo, Edward Norton, Edward Furlong"
42. The Prestige,2006,8.5 (1.5M),"Period Drama, Steampunk, Tragedy, Drama, Mystery, Sci-Fi, Thriller","Jonathan Nolan, Cutter, Hugh Jackman, Scarlett Johansson, Christopher Priest, Christian Bale, Keith Nichols, Christopher Nolan","Gross worldwide$109,676,311","Scarlett Johansson, Christian Bale, Hugh Jackman"
43. Léon: The Professional,1994,8.5 (1.3M),"Gangster, One-Person Army Action, Action, Crime, Drama, Thriller","Gary Oldman, Léon, Dominic Miller, Natalie Portman, Sting, Luc Besson, Jean Reno, Mathilda","Gross worldwide$20,278,989","Gary Oldman, Jean Reno, Natalie Portman"
44. Spider-Man: Across the Spider-Verse,2023,8.5 (443K),"Computer Animation, Superhero, Supernatural Fantasy, Teen Adventure, Urban Adventure, Action, Adventure, Animation, Family, Fantasy","Brittany Talia Hazzard, Christopher Miller, Brian Tyree Henry, Metro Boomin, Kemp Powers, Shameik Moore, Hailee Steinfeld, Johan Lenox, Joaquim Dos Santos, Phil Lord, Miles Morales, Dave Callaham, Spider-Man India, Prince 85, Coi Leray, Dre Moon, Justin K. Thompson, Preston Mutanga","Gross worldwide$690,824,738","Hailee Steinfeld, Brian Tyree Henry, Shameik Moore"
45. Casablanca,1942,8.5 (628K),"Drama, Romance, War","Howard Koch, Julius J. Epstein, Ingrid Bergman, Humphrey Bogart, Philip G. Epstein, Captain Renault, Max Steiner, Michael Curtiz, Paul Henreid, Rick, Madeleine Lebeau, Claude Joseph Rouget de Lisle","Gross worldwide$4,727,083","Humphrey Bogart, Ingrid Bergman, Paul Henreid"
46. The Usual Suspects,1995,8.5 (1.2M),"Caper, Gangster, Heist, Psychological Drama, Psychological Thriller, Suspense Mystery, Whodunnit, Crime, Drama, Mystery","Verbal, Chazz Palminteri, Christopher McQuarrie, Claude Debussy, Jon Kull, Bryan Singer, Gabriel Byrne, Kevin Spacey","Gross worldwide$23,341,568","Chazz Palminteri, Gabriel Byrne, Kevin Spacey"
47. The Intouchables,2011,8.5 (971K),"Docudrama, Comedy, Drama","Philippe Pozzo di Borgo, Maurice White, Philippe, Olivier Nakache, Anne Le Ny, Omar Sy, Earth Wind & Fire, Éric Toledano, François Cluzet, Allee Willis, Al McKay","Gross worldwide$426,590,315","François Cluzet, Anne Le Ny, Omar Sy"
48. Cinema Paradiso,1988,8.5 (299K),"Coming-of-Age, Drama, Romance","Antonella Attili, Giuseppe Tornatore, Salvatore, Philippe Noiret, Alfredo, Vanna Paoli, Ennio Morricone, Enzo Cannavale","Gross worldwide$13,020,497","Enzo Cannavale, Antonella Attili, Philippe Noiret"
49. Modern Times,1936,8.5 (271K),"Romantic Comedy, Satire, Slapstick, Comedy, Drama, Romance","A gamin, Charles Chaplin, Henry Bergman, Paulette Goddard, A factory worker","Gross worldwide$463,618","Paulette Goddard, Charles Chaplin, Henry Bergman"
50. Alien,1979,8.5 (1M),"Alien Invasion, Cyberpunk, Monster Horror, Space Sci-Fi, Horror, Sci-Fi","John Hurt, Tom Skerritt, Dan O'Bannon, Yaphet Kotto, Ripley, Sigourney Weaver, Ridley Scott, Ronald Shusett, Howard Hanson","Gross worldwide$108,610,231","John Hurt, Sigourney Weaver, Tom Skerritt"
51. Rear Window,1954,8.5 (543K),"Psychological Thriller, Suspense Mystery, Drama, Mystery, Thriller","Alfred Hitchcock, Grace Kelly, James Stewart, Cornell Woolrich, Wendell Corey, L.B. Jefferies, Leonard Bernstein, John Michael Hayes, Stella","Gross worldwide$37,905,475","Grace Kelly, Wendell Corey, James Stewart"
52. Once Upon a Time in the West,1968,8.5 (366K),"Desert Adventure, Epic, Spaghetti Western, Western Epic, Drama, Western","Sergio Donati, Harmonica, Charles Bronson, Sergio Leone, Snaky, Dario Argento, Henry Fonda, Claudia Cardinale, Simonetta Santaniello, Frederick Edward Weatherly","Gross worldwide$5,435,312","Claudia Cardinale, Henry Fonda, Charles Bronson"
53. Django Unchained,2012,8.5 (1.8M),"Dark Comedy, Epic, Period Drama, Western Epic, Western","Jamie Foxx, Christoph Waltz, Franco Migliacci, Django, Kerry Washington, Robert Mellin, Quentin Tarantino, Dr. King Schultz, Luis Bacalov, Bruno Nicolai, Rocky Roberts, Leonardo DiCaprio","Gross worldwide$426,076,293","Jamie Foxx, Leonardo DiCaprio, Christoph Waltz"
54. City Lights,1931,8.5 (206K),"Feel-Good Romance, Romantic Comedy, Satire, Slapstick, Comedy, Drama, Romance","Florence Lee, A Blind Girl, The Tramp, Georgia Hale, José Padilla, Harry Crocker, Virginia Cherrill, Harry Carr, Charles Chaplin","Gross worldwide$55,154","Florence Lee, Charles Chaplin, Virginia Cherrill"
55. Apocalypse Now,1979,8.4 (737K),"Adventure Epic, Epic, Hard-boiled Detective, Psychological Drama, Quest, Suspense Mystery, War Epic, Drama, Mystery, War","Vittorio Storaro, Ray Manzarek, John Milius, John Densmore, The Doors, Robert Duvall, Francis Ford Coppola, Michael Herr, Kurtz, Jim Morrison, Marlon Brando, Martin Sheen, Robby Krieger","Gross worldwide$105,086,099","Marlon Brando, Martin Sheen, Robert Duvall"
56. Dune: Part Two,2024,8.5 (612K),"Action Epic, Desert Adventure, Epic, Sci-Fi Epic, Space Sci-Fi, Action, Adventure, Drama, Sci-Fi","Stellan Skarsgård, Stilgar, Denis Villeneuve, Frank Herbert, Paul Atreides, Timothée Chalamet, Rebecca Ferguson, Zendaya, Jon Spaihts, Gurney Halleck, Hans Zimmer","Gross worldwide$714,644,358","Rebecca Ferguson, Timothée Chalamet, Zendaya"
57. Memento,2000,8.4 (1.4M),"Psychological Thriller, Suspense Mystery, Mystery, Thriller","Jonathan Nolan, Joe Pantoliano, Guy Pearce, David Bowie, Leonard Shelby, Reeves Gabrels, Carrie-Anne Moss, Christopher Nolan","Gross worldwide$40,047,236","Joe Pantoliano, Guy Pearce, Carrie-Anne Moss"
58. WALL·E,2008,8.4 (1.3M),"Adventure Epic, Artificial Intelligence, Computer Animation, Dystopian Sci-Fi, Space Sci-Fi, Adventure, Animation, Family, Sci-Fi","Ben Burtt, Pete Docter, Elissa Knight, Andrew Stanton, WALL.E, EVE, Jim Reardon, Jerry Herman, Jeff Garlin","Gross worldwide$527,403,656","Ben Burtt, Jeff Garlin, Elissa Knight"
59. Raiders of the Lost Ark,1981,8.4 (1.1M),"Adventure Epic, Desert Adventure, Globetrotting Adventure, Quest, Action, Adventure","Philip Kaufman, John Rhys-Davies, Marion, Indiana, Steven Spielberg, Lawrence Kasdan, Arthur Sullivan, Karen Allen, W.S. Gilbert, George Lucas, Paul Freeman, Harrison Ford","Gross worldwide$389,925,971","Paul Freeman, Harrison Ford, Karen Allen"
60. The Lives of Others,2006,8.4 (425K),"Political Thriller, Psychological Drama, Spy, Drama, Mystery, Thriller","Martina Gedeck, Ulrich Mühe, Joachim-Franz Bartzsch, Florian Henckel von Donnersmarck, Sebastian Koch, Kurt Demmler, Buchverkäufer, Hauptmann Gerd Wiesler","Gross worldwide$77,672,685","Martina Gedeck, Sebastian Koch, Ulrich Mühe"
61. Avengers: Infinity War,2018,8.4 (1.3M),"Space Sci-Fi, Superhero, Action, Adventure, Sci-Fi","Chris Hemsworth, Joe Russo, Robert Downey Jr., Linda Creed, The Spinners, Mark Ruffalo, Thor, Thom Bell, Anthony Russo, Stan Lee, Rocket Raccoon, Stephen McFeely, Tom Holland, Christopher Markus","Gross worldwide$2,052,415,039","Chris Hemsworth, Robert Downey Jr., Mark Ruffalo"
62. Sunset Boulevard,1950,8.4 (247K),"Dark Comedy, Film Noir, Psychological Drama, Showbiz Drama, Tragedy, Drama","William Holden, D.M. Marshman Jr., Joe Gillis, Norma Desmond, Charles Brackett, Erich von Stroheim, Gloria Swanson, Ray Evans, Jay Livingston, Roscoe 'Fatty' Arbuckle, Billy Wilder","Gross worldwide$309,467","William Holden, Erich von Stroheim, Gloria Swanson"
63. Spider-Man: Into the Spider-Verse,2018,8.4 (721K),"Computer Animation, Superhero, Supernatural Fantasy, Teen Adventure, Urban Adventure, Action, Adventure, Animation, Comedy, Family","Bob Persichetti, Stan Lee, St. Clair Pinckney, Shameik Moore, Rodney Rothman, Hailee Steinfeld, Stan, Fred Wesley, Phil Lord, Steve Ditko, Jake Johnson, Peter Ramsey, James Brown","Gross worldwide$393,602,435","Jake Johnson, Hailee Steinfeld, Shameik Moore"
64. Paths of Glory,1957,8.4 (225K),"Epic, Psychological Drama, War Epic, Drama, War","Adolphe Menjou, Stanley Kubrick, Calder Willingham, Jim Thompson, Ralph Meeker, Kirk Douglas, Pvt. Pierre Arnaud, Francisco Franco, Claude Joseph Rouget de Lisle","Gross worldwide$8,290","Adolphe Menjou, Ralph Meeker, Kirk Douglas"
65. Witness for the Prosecution,1957,8.4 (149K),"Legal Drama, Legal Thriller, Whodunnit, Crime, Drama, Mystery, Thriller","Marlene Dietrich, Maurice Zolotow, Ralph Arthur Roberts, Tyrone Power, Jack Brooks, Charles Laughton, Agatha Christie, Sir Wilfrid, Harry Kurnitz, Billy Wilder","Gross worldwide$7,903","Marlene Dietrich, Charles Laughton, Tyrone Power"
66. The Shining,1980,8.4 (1.2M),"Dark Comedy, Psychological Drama, Psychological Horror, Supernatural Horror, Drama, Horror","Anne Jackson, Jack Nicholson, Danny Lloyd, Wendy Carlos, Stanley Kubrick, Diane Johnson, Shelley Duvall, Rachel Elkind, Stephen King, Jack Torrance, Tony Burton, Hector Berlioz","Gross worldwide$47,962,534","Shelley Duvall, Danny Lloyd, Jack Nicholson"
67. The Great Dictator,1940,8.4 (248K),"Parody, Satire, Slapstick, Comedy, Drama, War","Benito Mussolini, Johannes Brahms, Adolf Hitler, Mr. Jaeckel, A Jewish Barber, Jack Oakie, Hannah, Paulette Goddard, Charles Chaplin","Gross worldwide$972,212","Paulette Goddard, Charles Chaplin, Jack Oakie"
68. 12th Fail,2023,8.8 (144K),"Docudrama, Biography, Drama","Vidhu Vinod Chopra, Manoj Sharma, Vikrant Massey, Medha Shankr, Anant Joshi, Jaskunwar Kohli, Anurag Pathak","Gross worldwide$138,288","Vikrant Massey, Medha Shankr, Anant Joshi"
69. Aliens,1986,8.4 (804K),"Alien Invasion, Cyberpunk, Monster Horror, Space Sci-Fi, Survival, Tragedy, Action, Adventure, Horror, Sci-Fi","Private Vasquez, Walter Hill, Private Hudson, Sigourney Weaver, Lance Henriksen, Carrie Henn, James Cameron, Michael Biehn, David Giler","Gross worldwide$131,060,248","Carrie Henn, Sigourney Weaver, Michael Biehn"
70. Inglourious Basterds,2009,8.4 (1.7M),"Dark Comedy, Period Drama, Adventure, Drama, War","Pfc. Omar Ulmer, The Nick Perito Orchestra, Christoph Waltz, Lt. Aldo Raine, Brad Pitt, Lawrence Bender, Quentin Tarantino, Dimitri Tiomkin, Paul Francis Webster, Eli Roth, Diane Kruger","Gross worldwide$321,460,744","Brad Pitt, Eli Roth, Diane Kruger"
71. The Dark Knight Rises,2012,8.4 (1.9M),"Action Epic, Epic, Superhero, Action, Drama, Thriller","Jonathan Nolan, Tom Hardy, Anne Hathaway, Bryan Singer, Stanislaw Skrowaczewski, Minnesota Orchestra, Batman, Maurice Ravel, Jim Gordon, Heath Ledger, Christian Bale, Marlon Brando, Christopher Nolan, David S. Goyer","Gross worldwide$1,114,976,407","Anne Hathaway, Christian Bale, Tom Hardy"
72. Coco,2017,8.4 (642K),"Computer Animation, Supernatural Fantasy, Adventure, Animation, Drama, Family, Fantasy, Music, Mystery","Jason Katz, Matthew Aldrich, Lee Unkrich, Anthony Gonzalez, Libertad García Fonzi, Benjamin Bratt, Ana Ofelia Murguía, Héctor, Robert Lopez, Germaine Franco, Adrian Molina, Kristen Anderson-Lopez, Gael García Bernal","Gross worldwide$814,641,172","Benjamin Bratt, Anthony Gonzalez, Gael García Bernal"
